{
  "_schema_version": "2.0.0",
  "_metadata": {
    "created_at": "2025-01-18T00:00:00Z",
    "created_by": "YOUR_NAME",
    "review_status": "draft",
    "revision_number": 1,
    "tags": ["TOPIC_TAG"]
  },
  
  "question_key": "RCAI_FUND_001",
  "question_text": "Your question text here - clear and concise",
  
  "question_format": "single_choice",
  
  "category": {
    "primary": "fundamentals",
    "code": "ai_basics", 
    "subcategories": ["artificial_intelligence"],
    "skills": ["ai_literacy"]
  },
  
  "difficulty": {
    "level": "beginner",
    "score": 2
  },
  
  "assessment_config": {
    "question_types": ["practice"],
    "certification_levels": ["RCAF"],
    "time_allocation": {
      "seconds": 90
    },
    "points": {
      "base_points": 2
    }
  },
  
  "content": {
    "options": [
      {"id": "A", "text": "First option"},
      {"id": "B", "text": "Second option"},
      {"id": "C", "text": "Third option"},
      {"id": "D", "text": "Fourth option"}
    ],
    "correct_answer": {
      "option_id": "A",
      "explanation": "Why this is correct"
    },
    "randomize_options": true
  },
  
  "explanation": {
    "correct_answer_explanation": "Detailed explanation of the correct answer and why it's right",
    "incorrect_explanations": [
      {"option_id": "B", "explanation": "Why this is wrong"},
      {"option_id": "C", "explanation": "Why this is wrong"},
      {"option_id": "D", "explanation": "Why this is wrong"}
    ]
  },
  
  "business_context": {
    "real_world_application": "How this applies in real business scenarios",
    "industry_relevance": ["technology", "consulting"],
    "role_relevance": ["product_manager", "business_analyst"],
    "impact_level": "medium"
  },
  
  "status": {
    "active": true,
    "published": false,
    "featured": false
  }
}
